<?xml version="1.0" encoding="UTF-8"?>
<item_list xmlns:xsi="http://www.w3.org/2001/XMLSchema-instance" xsi:noNamespaceSchemaLocation="items.xsd">
  <item>
    <id>0</id>
    <knowledge>knowledge</knowledge>
    <area>area</area>
    <topic_list>
      <topics>topics</topics>
    </topic_list>
    <expression>expression</expression>
    <learning_taxonomy_list>
      <learning_taxonomy>learning_taxonomy</learning_taxonomy>
    </learning_taxonomy_list>
    <image_list>
      <image>image</image>
    </image_list>
    <question_list>
      <question>
        <question_id>0</question_id>
        <topic_list>
          <topics>topics</topics>
        </topic_list>
        <depth>depth</depth>
        <stem_lead-in_questions>stem_lead-in_questions</stem_lead-in_questions>
        <option_list>
          <incorrect_option>incorrect_option</incorrect_option>
          <partiallly_correct_option>partiallly_correct_option</partiallly_correct_option>
          <correct>correct</correct>
        </option_list>
        <hint>hint</hint>
        <correct_feedback>correct_feedback</correct_feedback>
        <incorrect_feedback>incorrect_feedback</incorrect_feedback>
        <correct_follow_up_question_list>0</correct_follow_up_question_list>
        <incorrect_follow_up_question_list>0</incorrect_follow_up_question_list>
      </question>
    </question_list>
  </item>
</item_list>
